{
  "meta": {
    "title": "Вопросы и ответы — студия «Эстетика»",
    "description": "Сколько стоит окрашивание, как записаться, есть ли гарантия и сколько занимает визит. Ответы на частые вопросы студии красоты «Эстетика».",
    "url": "https://sabutorin97-boop.github.io/remix-of-ai-business-solutions/faq/",
    "lang": "ru",
    "image": "og.jpg"
  },
  "brand": {
    "name": "Студия «Эстетика»",
    "tagline": "Студия красоты в Екатеринбурге: сложное окрашивание и восстановление волос",
    "site_url": "https://example.com"
  },
  "intro": {
    "headline": "Отвечаем на вопросы, которые задают чаще всего",
    "text": "Собрали здесь то, что обычно спрашивают в переписке: цены, сроки, гарантию и порядок записи. Если вопроса нет в списке — напишите, ответим и добавим.",
    "updated": "12 сентября 2026"
  },
  "faq": [
    {
      "q": "Сколько стоит сложное окрашивание?",
      "a": "Стоимость зависит от длины волос и от того, сколько окрашиваний было раньше. Работа на длине до плеч начинается от 6 000 рублей, длина ниже лопаток с выходом из тёмного цвета обходится в 12 000–18 000 рублей за визит. Точную сумму называем на бесплатной консультации после диагностики: смотрим состояние волос и проверяем реакцию на осветлитель. Если результат потребует нескольких визитов, расписываем стоимость каждого этапа заранее, чтобы итоговая сумма не оказалась сюрпризом."
    },
    {
      "q": "Как записаться в студию?",
      "a": "Записаться можно в Telegram или по телефону в рабочие часы студии. Напишите желаемую дату, длину волос и приложите фото при дневном свете — так администратор сразу подберёт мастера и заложит нужное время. На сложное окрашивание записываем только после консультации: она занимает двадцать минут, бесплатна и ни к чему не обязывает. Отменить или перенести визит можно не позднее чем за сутки, тогда предоплата сохраняется на следующую запись."
    },
    {
      "q": "Есть ли гарантия на окрашивание?",
      "a": "Если оттенок получился не таким, как договаривались на консультации, мы исправляем его бесплатно в течение двух недель после визита. Гарантия не распространяется на изменения цвета из-за домашних окрашиваний, бассейна с хлором и ухода с агрессивными шампунями — об этих ограничениях мастер предупреждает заранее и выдаёт памятку. Спорные случаи разбираем вместе с фотографиями «до и после», которые делаем при каждом визите."
    },
    {
      "q": "Сколько времени занимает визит?",
      "a": "Консультация с диагностикой — двадцать минут. Тонирование или окрашивание корней занимает полтора-два часа. Сложное окрашивание с осветлением длины идёт от четырёх до шести часов, поэтому такие работы мы ставим на первую половину дня и заранее предупреждаем о времени. Курс восстановления — по часу за визит. Точный интервал администратор называет при записи, чтобы вы могли спланировать день и не торопить мастера."
    },
    {
      "q": "Можно ли прийти со своим уходом?",
      "a": "Можно, мастер посмотрит состав и скажет, подходит ли средство вашим волосам после окрашивания. На саму работу это не влияет и доплат не требует. Если ваш шампунь сушит волосы или вымывает оттенок, мастер объяснит, почему так происходит, и предложит замену в том же бюджете. Навязывать набор из восьми банок мы не станем: обычно достаточно двух-трёх средств."
    }
  ],
  "cta": {
    "title": "Не нашли свой вопрос?",
    "text": "Напишите в Telegram или позвоните — ответим в рабочие часы. Частые вопросы добавляем на эту страницу.",
    "button": "Написать нам",
    "url": "mailto:demo@example.com"
  },
  "contacts": {
    "phone": "+7 000 000-00-00",
    "email": "demo@example.com",
    "hours": "Пн–Сб с 10:00 до 21:00",
    "telegram": null
  },
  "design": {
    "scheme": "light",
    "accent": "#7A2E4E",
    "font": "serif",
    "radius": "soft"
  },
  "legal": {
    "entity": "Демонстрационный пример, не организация"
  }
}
